22:02:42.388074 IP 10.20.30.10.60590 > ns2.unicamp.br.domain: 24715+ A? arquivos.mhnet.com.br. (39)
22:02:42.388095 IP 10.20.30.10.60590 > google-public-dns-a.google.com.domain: 24715+ A? arquivos.mhnet.com.br. (39)
22:02:42.388138 IP 10.20.30.10.60590 > ns2.unicamp.br.domain: 63867+ AAAA? arquivos.mhnet.com.br. (39)
22:02:42.413833 IP ns2.unicamp.br.domain > 10.20.30.10.60590: 63867 1/2/0 AAAA 2804:108c:cab0::9651 (103)
22:02:42.420907 IP ns2.unicamp.br.domain > 10.20.30.10.60590: 24715 1/2/0 A 187.45.96.51 (91)
22:02:42.421203 IP 10.20.30.10.60050 > 187.45.96.51.https: Flags [S], seq 2409434484, win 29200, options [mss 1460,sackOK,TS val 2587788151 ecr 0,nop,wscale 7], length 0
22:02:42.454271 IP 187.45.96.51.https > 10.20.30.10.60050: Flags [S.], seq 480147943, ack 2409434485, win 28960, options [mss 1460,sackOK,TS val 3976062726 ecr 2587788151,nop,wscale 7], length 0
22:02:42.454340 IP 10.20.30.10.60050 > 187.45.96.51.https: Flags [.], ack 1, win 229, options [nop,nop,TS val 2587788159 ecr 3976062726], length 0
22:02:42.454689 IP 10.20.30.10.60050 > 187.45.96.51.https: Flags [P.], seq 1:336, ack 1, win 229, options [nop,nop,TS val 2587788159 ecr 3976062726], length 335
22:02:42.484136 IP 187.45.96.51.https > 10.20.30.10.60050: Flags [.], ack 336, win 235, options [nop,nop,TS val 3976062735 ecr 2587788159], length 0
22:02:42.486864 IP 187.45.96.51.https > 10.20.30.10.60050: Flags [.], seq 1:1449, ack 336, win 235, options [nop,nop,TS val 3976062735 ecr 2587788159], length 1448
22:02:42.486894 IP 10.20.30.10.60050 > 187.45.96.51.https: Flags [.], ack 1449, win 251, options [nop,nop,TS val 2587788167 ecr 3976062735], length 0
22:02:42.487054 IP 187.45.96.51.https > 10.20.30.10.60050: Flags [.], seq 1449:2897, ack 336, win 235, options [nop,nop,TS val 3976062735 ecr 2587788159], length 1448
22:02:42.487060 IP 187.45.96.51.https > 10.20.30.10.60050: Flags [P.], seq 2897:3175, ack 336, win 235, options [nop,nop,TS val 3976062736 ecr 2587788159], length 278
22:02:42.487088 IP 10.20.30.10.60050 > 187.45.96.51.https: Flags [.], ack 2897, win 274, options [nop,nop,TS val 2587788167 ecr 3976062735], length 0
22:02:42.487097 IP 10.20.30.10.60050 > 187.45.96.51.https: Flags [.], ack 3175, win 296, options [nop,nop,TS val 2587788167 ecr 3976062736], length 0
22:02:42.488280 IP 10.20.30.10.60050 > 187.45.96.51.https: Flags [P.], seq 336:462, ack 3175, win 296, options [nop,nop,TS val 2587788167 ecr 3976062736], length 126
22:02:42.505494 IP google-public-dns-a.google.com.domain > 10.20.30.10.60590: 24715 1/0/0 A 187.45.96.51 (55)
22:02:42.516009 IP 187.45.96.51.https > 10.20.30.10.60050: Flags [P.], seq 3175:3449, ack 462, win 235, options [nop,nop,TS val 3976062743 ecr 2587788167], length 274
22:02:42.516214 IP 10.20.30.10.60050 > 187.45.96.51.https: Flags [P.], seq 462:646, ack 3449, win 319, options [nop,nop,TS val 2587788174 ecr 3976062743], length 184
22:02:42.542618 IP 187.45.96.51.https > 10.20.30.10.60050: Flags [.], seq 3449:6345, ack 646, win 243, options [nop,nop,TS val 3976062750 ecr 2587788174], length 2896
22:02:42.542653 IP 10.20.30.10.60050 > 187.45.96.51.https: Flags [.], ack 6345, win 364, options [nop,nop,TS val 2587788181 ecr 3976062750], length 0
22:02:42.542697 IP 187.45.96.51.https > 10.20.30.10.60050: Flags [.], seq 6345:7793, ack 646, win 243, options [nop,nop,TS val 3976062750 ecr 2587788174], length 1448
22:02:42.542973 IP 187.45.96.51.https > 10.20.30.10.60050: Flags [.], seq 7793:10689, ack 646, win 243, options [nop,nop,TS val 3976062750 ecr 2587788174], length 2896
22:02:42.542982 IP 10.20.30.10.60050 > 187.45.96.51.https: Flags [.], ack 10689, win 432, options [nop,nop,TS val 2587788181 ecr 3976062750], length 0
22:02:42.543223 IP 187.45.96.51.https > 10.20.30.10.60050: Flags [.], seq 10689:13585, ack 646, win 243, options [nop,nop,TS val 3976062750 ecr 2587788174], length 2896
22:02:42.543232 IP 10.20.30.10.60050 > 187.45.96.51.https: Flags [.], ack 13585, win 477, options [nop,nop,TS val 2587788181 ecr 3976062750], length 0
22:02:42.543487 IP 187.45.96.51.https > 10.20.30.10.60050: Flags [.], seq 13585:16481, ack 646, win 243, options [nop,nop,TS val 3976062750 ecr 2587788174], length 2896
22:02:42.543506 IP 10.20.30.10.60050 > 187.45.96.51.https: Flags [.], ack 16481, win 523, options [nop,nop,TS val 2587788181 ecr 3976062750], length 0
22:02:42.543790 IP 187.45.96.51.https > 10.20.30.10.60050: Flags [.], seq 16481:17929, ack 646, win 243, options [nop,nop,TS val 3976062750 ecr 2587788174], length 1448
22:02:42.568060 IP 187.45.96.51.https > 10.20.30.10.60050: Flags [.], seq 17929:20825, ack 646, win 243, options [nop,nop,TS val 3976062757 ecr 2587788181], length 2896
22:02:42.568090 IP 10.20.30.10.60050 > 187.45.96.51.https: Flags [.], ack 20825, win 591, options [nop,nop,TS val 2587788187 ecr 3976062750], length 0
22:02:42.568153 IP 187.45.96.51.https > 10.20.30.10.60050: Flags [.], seq 20825:22273, ack 646, win 243, options [nop,nop,TS val 3976062757 ecr 2587788181], length 1448
22:02:42.568452 IP 187.45.96.51.https > 10.20.30.10.60050: Flags [.], seq 22273:25169, ack 646, win 243, options [nop,nop,TS val 3976062757 ecr 2587788181], length 2896
22:02:42.568464 IP 10.20.30.10.60050 > 187.45.96.51.https: Flags [.], ack 25169, win 658, options [nop,nop,TS val 2587788187 ecr 3976062757], length 0
22:02:42.568703 IP 187.45.96.51.https > 10.20.30.10.60050: Flags [.], seq 25169:28065, ack 646, win 243, options [nop,nop,TS val 3976062757 ecr 2587788181], length 2896
22:02:42.568718 IP 10.20.30.10.60050 > 187.45.96.51.https: Flags [.], ack 28065, win 704, options [nop,nop,TS val 2587788187 ecr 3976062757], length 0
22:02:42.568950 IP 187.45.96.51.https > 10.20.30.10.60050: Flags [.], seq 28065:30961, ack 646, win 243, options [nop,nop,TS val 3976062757 ecr 2587788181], length 2896
22:02:42.568962 IP 10.20.30.10.60050 > 187.45.96.51.https: Flags [.], ack 30961, win 749, options [nop,nop,TS val 2587788188 ecr 3976062757], length 0
22:02:42.569151 IP 187.45.96.51.https > 10.20.30.10.60050: Flags [.], seq 30961:33857, ack 646, win 243, options [nop,nop,TS val 3976062757 ecr 2587788181], length 2896
22:02:42.569161 IP 10.20.30.10.60050 > 187.45.96.51.https: Flags [.], ack 33857, win 794, options [nop,nop,TS val 2587788188 ecr 3976062757], length 0
22:02:42.569396 IP 187.45.96.51.https > 10.20.30.10.60050: Flags [.], seq 33857:36753, ack 646, win 243, options [nop,nop,TS val 3976062757 ecr 2587788181], length 2896
22:02:42.569405 IP 10.20.30.10.60050 > 187.45.96.51.https: Flags [.], ack 36753, win 839, options [nop,nop,TS val 2587788188 ecr 3976062757], length 0
22:02:42.569650 IP 187.45.96.51.https > 10.20.30.10.60050: Flags [.], seq 36753:39649, ack 646, win 243, options [nop,nop,TS val 3976062757 ecr 2587788181], length 2896
22:02:42.569660 IP 10.20.30.10.60050 > 187.45.96.51.https: Flags [.], ack 39649, win 885, options [nop,nop,TS val 2587788188 ecr 3976062757], length 0
22:02:42.569918 IP 187.45.96.51.https > 10.20.30.10.60050: Flags [.], seq 39649:42545, ack 646, win 243, options [nop,nop,TS val 3976062757 ecr 2587788181], length 2896
22:02:42.569928 IP 10.20.30.10.60050 > 187.45.96.51.https: Flags [.], ack 42545, win 930, options [nop,nop,TS val 2587788188 ecr 3976062757], length 0
22:02:42.570182 IP 187.45.96.51.https > 10.20.30.10.60050: Flags [.], seq 42545:43993, ack 646, win 243, options [nop,nop,TS val 3976062757 ecr 2587788181], length 1448
22:02:42.591353 IP 187.45.96.51.https > 10.20.30.10.60050: Flags [.], seq 43993:45441, ack 646, win 243, options [nop,nop,TS val 3976062763 ecr 2587788187], length 1448
22:02:42.591397 IP 187.45.96.51.https > 10.20.30.10.60050: Flags [.], seq 45441:48337, ack 646, win 243, options [nop,nop,TS val 3976062763 ecr 2587788187], length 2896
22:02:42.591418 IP 10.20.30.10.60050 > 187.45.96.51.https: Flags [.], ack 45441, win 975, options [nop,nop,TS val 2587788193 ecr 3976062757], length 0
22:02:42.591431 IP 10.20.30.10.60050 > 187.45.96.51.https: Flags [.], ack 48337, win 1020, options [nop,nop,TS val 2587788193 ecr 3976062763], length 0
22:02:42.591686 IP 187.45.96.51.https > 10.20.30.10.60050: Flags [.], seq 48337:51233, ack 646, win 243, options [nop,nop,TS val 3976062763 ecr 2587788187], length 2896
22:02:42.591710 IP 10.20.30.10.60050 > 187.45.96.51.https: Flags [.], ack 51233, win 1066, options [nop,nop,TS val 2587788193 ecr 3976062763], length 0
22:02:42.591935 IP 187.45.96.51.https > 10.20.30.10.60050: Flags [.], seq 51233:54129, ack 646, win 243, options [nop,nop,TS val 3976062763 ecr 2587788187], length 2896
22:02:42.591957 IP 10.20.30.10.60050 > 187.45.96.51.https: Flags [.], ack 54129, win 1111, options [nop,nop,TS val 2587788193 ecr 3976062763], length 0
22:02:42.592127 IP 187.45.96.51.https > 10.20.30.10.60050: Flags [.], seq 54129:57025, ack 646, win 243, options [nop,nop,TS val 3976062763 ecr 2587788187], length 2896
22:02:42.592131 IP 10.20.30.10.60050 > 187.45.96.51.https: Flags [.], ack 57025, win 1156, options [nop,nop,TS val 2587788193 ecr 3976062763], length 0
22:02:42.592357 IP 187.45.96.51.https > 10.20.30.10.60050: Flags [.], seq 57025:59921, ack 646, win 243, options [nop,nop,TS val 3976062763 ecr 2587788187], length 2896
22:02:42.592361 IP 10.20.30.10.60050 > 187.45.96.51.https: Flags [.], ack 59921, win 1201, options [nop,nop,TS val 2587788193 ecr 3976062763], length 0
22:02:42.592626 IP 187.45.96.51.https > 10.20.30.10.60050: Flags [.], seq 59921:62817, ack 646, win 243, options [nop,nop,TS val 3976062763 ecr 2587788187], length 2896
22:02:42.592644 IP 10.20.30.10.60050 > 187.45.96.51.https: Flags [.], ack 62817, win 1247, options [nop,nop,TS val 2587788193 ecr 3976062763], length 0
22:02:42.592873 IP 187.45.96.51.https > 10.20.30.10.60050: Flags [.], seq 62817:65713, ack 646, win 243, options [nop,nop,TS val 3976062763 ecr 2587788187], length 2896
22:02:42.592890 IP 10.20.30.10.60050 > 187.45.96.51.https: Flags [.], ack 65713, win 1292, options [nop,nop,TS val 2587788194 ecr 3976062763], length 0
22:02:42.593197 IP 187.45.96.51.https > 10.20.30.10.60050: Flags [.], seq 65713:67161, ack 646, win 243, options [nop,nop,TS val 3976062763 ecr 2587788187], length 1448
22:02:42.593202 IP 187.45.96.51.https > 10.20.30.10.60050: Flags [.], seq 67161:70057, ack 646, win 243, options [nop,nop,TS val 3976062763 ecr 2587788188], length 2896
22:02:42.593214 IP 10.20.30.10.60050 > 187.45.96.51.https: Flags [.], ack 70057, win 1360, options [nop,nop,TS val 2587788194 ecr 3976062763], length 0
22:02:42.593366 IP 187.45.96.51.https > 10.20.30.10.60050: Flags [.], seq 70057:71505, ack 646, win 243, options [nop,nop,TS val 3976062763 ecr 2587788188], length 1448
22:02:42.593676 IP 187.45.96.51.https > 10.20.30.10.60050: Flags [P.], seq 71505:72953, ack 646, win 243, options [nop,nop,TS val 3976062763 ecr 2587788188], length 1448
22:02:42.593682 IP 187.45.96.51.https > 10.20.30.10.60050: Flags [.], seq 72953:75849, ack 646, win 243, options [nop,nop,TS val 3976062763 ecr 2587788188], length 2896
22:02:42.593692 IP 10.20.30.10.60050 > 187.45.96.51.https: Flags [.], ack 72953, win 1405, options [nop,nop,TS val 2587788194 ecr 3976062763], length 0
22:02:42.593699 IP 10.20.30.10.60050 > 187.45.96.51.https: Flags [.], ack 75849, win 1444, options [nop,nop,TS val 2587788194 ecr 3976062763], length 0
22:02:42.593878 IP 187.45.96.51.https > 10.20.30.10.60050: Flags [.], seq 75849:77297, ack 646, win 243, options [nop,nop,TS val 3976062763 ecr 2587788188], length 1448
22:02:42.594106 IP 187.45.96.51.https > 10.20.30.10.60050: Flags [.], seq 77297:80193, ack 646, win 243, options [nop,nop,TS val 3976062763 ecr 2587788188], length 2896
22:02:42.594123 IP 10.20.30.10.60050 > 187.45.96.51.https: Flags [.], ack 80193, win 1444, options [nop,nop,TS val 2587788194 ecr 3976062763], length 0
22:02:42.594385 IP 187.45.96.51.https > 10.20.30.10.60050: Flags [.], seq 80193:84537, ack 646, win 243, options [nop,nop,TS val 3976062763 ecr 2587788188], length 4344
22:02:42.594409 IP 10.20.30.10.60050 > 187.45.96.51.https: Flags [.], ack 84537, win 1444, options [nop,nop,TS val 2587788194 ecr 3976062763], length 0
22:02:42.594680 IP 187.45.96.51.https > 10.20.30.10.60050: Flags [.], seq 84537:87433, ack 646, win 243, options [nop,nop,TS val 3976062763 ecr 2587788188], length 2896
22:02:42.594704 IP 10.20.30.10.60050 > 187.45.96.51.https: Flags [.], ack 87433, win 1433, options [nop,nop,TS val 2587788194 ecr 3976062763], length 0
22:02:42.594876 IP 187.45.96.51.https > 10.20.30.10.60050: Flags [.], seq 87433:90329, ack 646, win 243, options [nop,nop,TS val 3976062763 ecr 2587788188], length 2896
22:02:42.595063 IP 10.20.30.10.60050 > 187.45.96.51.https: Flags [.], ack 90329, win 1411, options [nop,nop,TS val 2587788194 ecr 3976062763], length 0
22:02:42.595165 IP 187.45.96.51.https > 10.20.30.10.60050: Flags [.], seq 90329:93225, ack 646, win 243, options [nop,nop,TS val 3976062763 ecr 2587788188], length 2896
22:02:42.595182 IP 10.20.30.10.60050 > 187.45.96.51.https: Flags [.], ack 93225, win 1444, options [nop,nop,TS val 2587788194 ecr 3976062763], length 0
22:02:42.595448 IP 187.45.96.51.https > 10.20.30.10.60050: Flags [.], seq 93225:96121, ack 646, win 243, options [nop,nop,TS val 3976062763 ecr 2587788188], length 2896
22:02:42.595462 IP 10.20.30.10.60050 > 187.45.96.51.https: Flags [.], ack 96121, win 1444, options [nop,nop,TS val 2587788194 ecr 3976062763], length 0
22:02:42.613674 IP 187.45.96.51.https > 10.20.30.10.60050: Flags [P.], seq 96121:99017, ack 646, win 243, options [nop,nop,TS val 3976062769 ecr 2587788193], length 2896
22:02:42.613725 IP 10.20.30.10.60050 > 187.45.96.51.https: Flags [.], ack 99017, win 1444, options [nop,nop,TS val 2587788199 ecr 3976062769], length 0
22:02:42.613858 IP 187.45.96.51.https > 10.20.30.10.60050: Flags [.], seq 99017:101913, ack 646, win 243, options [nop,nop,TS val 3976062769 ecr 2587788193], length 2896
22:02:42.613888 IP 10.20.30.10.60050 > 187.45.96.51.https: Flags [.], ack 101913, win 1444, options [nop,nop,TS val 2587788199 ecr 3976062769], length 0
22:02:42.614055 IP 187.45.96.51.https > 10.20.30.10.60050: Flags [.], seq 101913:104809, ack 646, win 243, options [nop,nop,TS val 3976062769 ecr 2587788193], length 2896
22:02:42.614086 IP 10.20.30.10.60050 > 187.45.96.51.https: Flags [.], ack 104809, win 1433, options [nop,nop,TS val 2587788199 ecr 3976062769], length 0
22:02:42.614263 IP 187.45.96.51.https > 10.20.30.10.60050: Flags [.], seq 104809:107705, ack 646, win 243, options [nop,nop,TS val 3976062769 ecr 2587788193], length 2896
22:02:42.614564 IP 187.45.96.51.https > 10.20.30.10.60050: Flags [.], seq 107705:110601, ack 646, win 243, options [nop,nop,TS val 3976062769 ecr 2587788193], length 2896
22:02:42.614610 IP 10.20.30.10.60050 > 187.45.96.51.https: Flags [.], ack 110601, win 1390, options [nop,nop,TS val 2587788199 ecr 3976062769], length 0
22:02:42.614814 IP 187.45.96.51.https > 10.20.30.10.60050: Flags [.], seq 110601:113497, ack 646, win 243, options [nop,nop,TS val 3976062769 ecr 2587788193], length 2896
22:02:42.614846 IP 10.20.30.10.60050 > 187.45.96.51.https: Flags [.], ack 113497, win 1444, options [nop,nop,TS val 2587788199 ecr 3976062769], length 0
22:02:42.615056 IP 187.45.96.51.https > 10.20.30.10.60050: Flags [.], seq 113497:116393, ack 646, win 243, options [nop,nop,TS val 3976062769 ecr 2587788193], length 2896
22:02:42.615086 IP 10.20.30.10.60050 > 187.45.96.51.https: Flags [.], ack 116393, win 1444, options [nop,nop,TS val 2587788199 ecr 3976062769], length 0
22:02:42.615319 IP 187.45.96.51.https > 10.20.30.10.60050: Flags [.], seq 116393:119289, ack 646, win 243, options [nop,nop,TS val 3976062769 ecr 2587788193], length 2896
22:02:42.615350 IP 10.20.30.10.60050 > 187.45.96.51.https: Flags [.], ack 119289, win 1433, options [nop,nop,TS val 2587788199 ecr 3976062769], length 0
22:02:42.615512 IP 187.45.96.51.https > 10.20.30.10.60050: Flags [.], seq 119289:122185, ack 646, win 243, options [nop,nop,TS val 3976062769 ecr 2587788193], length 2896
22:02:42.615756 IP 187.45.96.51.https > 10.20.30.10.60050: Flags [.], seq 122185:125081, ack 646, win 243, options [nop,nop,TS val 3976062769 ecr 2587788193], length 2896
22:02:42.615860 IP 10.20.30.10.60050 > 187.45.96.51.https: Flags [.], ack 125081, win 1389, options [nop,nop,TS val 2587788199 ecr 3976062769], length 0
22:02:42.616015 IP 187.45.96.51.https > 10.20.30.10.60050: Flags [.], seq 125081:127977, ack 646, win 243, options [nop,nop,TS val 3976062769 ecr 2587788193], length 2896
22:02:42.616033 IP 10.20.30.10.60050 > 187.45.96.51.https: Flags [.], ack 127977, win 1444, options [nop,nop,TS val 2587788199 ecr 3976062769], length 0
22:02:42.616278 IP 187.45.96.51.https > 10.20.30.10.60050: Flags [.], seq 127977:130873, ack 646, win 243, options [nop,nop,TS val 3976062769 ecr 2587788193], length 2896
22:02:42.616295 IP 10.20.30.10.60050 > 187.45.96.51.https: Flags [.], ack 130873, win 1444, options [nop,nop,TS val 2587788199 ecr 3976062769], length 0
22:02:42.616516 IP 187.45.96.51.https > 10.20.30.10.60050: Flags [.], seq 130873:133769, ack 646, win 243, options [nop,nop,TS val 3976062769 ecr 2587788193], length 2896
22:02:42.616529 IP 10.20.30.10.60050 > 187.45.96.51.https: Flags [.], ack 133769, win 1444, options [nop,nop,TS val 2587788199 ecr 3976062769], length 0
22:02:42.616789 IP 187.45.96.51.https > 10.20.30.10.60050: Flags [.], seq 133769:136665, ack 646, win 243, options [nop,nop,TS val 3976062769 ecr 2587788193], length 2896
22:02:42.616803 IP 10.20.30.10.60050 > 187.45.96.51.https: Flags [.], ack 136665, win 1433, options [nop,nop,TS val 2587788199 ecr 3976062769], length 0
22:02:42.617034 IP 187.45.96.51.https > 10.20.30.10.60050: Flags [.], seq 136665:139561, ack 646, win 243, options [nop,nop,TS val 3976062769 ecr 2587788194], length 2896
22:02:42.617257 IP 187.45.96.51.https > 10.20.30.10.60050: Flags [.], seq 139561:142457, ack 646, win 243, options [nop,nop,TS val 3976062769 ecr 2587788194], length 2896
22:02:42.617292 IP 10.20.30.10.60050 > 187.45.96.51.https: Flags [.], ack 142457, win 1444, options [nop,nop,TS val 2587788200 ecr 3976062769], length 0
22:02:42.617518 IP 187.45.96.51.https > 10.20.30.10.60050: Flags [.], seq 142457:145353, ack 646, win 243, options [nop,nop,TS val 3976062769 ecr 2587788194], length 2896
22:02:42.617536 IP 10.20.30.10.60050 > 187.45.96.51.https: Flags [.], ack 145353, win 1489, options [nop,nop,TS val 2587788200 ecr 3976062769], length 0
22:02:42.617779 IP 187.45.96.51.https > 10.20.30.10.60050: Flags [.], seq 145353:148249, ack 646, win 243, options [nop,nop,TS val 3976062769 ecr 2587788194], length 2896
22:02:42.617796 IP 10.20.30.10.60050 > 187.45.96.51.https: Flags [.], ack 148249, win 1535, options [nop,nop,TS val 2587788200 ecr 3976062769], length 0
22:02:42.618030 IP 187.45.96.51.https > 10.20.30.10.60050: Flags [.], seq 148249:151145, ack 646, win 243, options [nop,nop,TS val 3976062769 ecr 2587788194], length 2896
22:02:42.618047 IP 10.20.30.10.60050 > 187.45.96.51.https: Flags [.], ack 151145, win 1580, options [nop,nop,TS val 2587788200 ecr 3976062769], length 0
22:02:42.618324 IP 187.45.96.51.https > 10.20.30.10.60050: Flags [.], seq 151145:154041, ack 646, win 243, options [nop,nop,TS val 3976062769 ecr 2587788194], length 2896
22:02:42.618353 IP 10.20.30.10.60050 > 187.45.96.51.https: Flags [.], ack 154041, win 1625, options [nop,nop,TS val 2587788200 ecr 3976062769], length 0
22:02:42.618515 IP 187.45.96.51.https > 10.20.30.10.60050: Flags [.], seq 154041:156937, ack 646, win 243, options [nop,nop,TS val 3976062769 ecr 2587788194], length 2896
22:02:42.618520 IP 10.20.30.10.60050 > 187.45.96.51.https: Flags [.], ack 156937, win 1670, options [nop,nop,TS val 2587788200 ecr 3976062769], length 0
22:02:42.618760 IP 187.45.96.51.https > 10.20.30.10.60050: Flags [.], seq 156937:159833, ack 646, win 243, options [nop,nop,TS val 3976062769 ecr 2587788194], length 2896
22:02:42.618763 IP 10.20.30.10.60050 > 187.45.96.51.https: Flags [.], ack 159833, win 1716, options [nop,nop,TS val 2587788200 ecr 3976062769], length 0
22:02:42.619036 IP 187.45.96.51.https > 10.20.30.10.60050: Flags [.], seq 159833:162729, ack 646, win 243, options [nop,nop,TS val 3976062769 ecr 2587788194], length 2896
22:02:42.619057 IP 10.20.30.10.60050 > 187.45.96.51.https: Flags [.], ack 162729, win 1761, options [nop,nop,TS val 2587788200 ecr 3976062769], length 0
22:02:42.619319 IP 187.45.96.51.https > 10.20.30.10.60050: Flags [.], seq 162729:165625, ack 646, win 243, options [nop,nop,TS val 3976062769 ecr 2587788194], length 2896
22:02:42.619349 IP 10.20.30.10.60050 > 187.45.96.51.https: Flags [.], ack 165625, win 1806, options [nop,nop,TS val 2587788200 ecr 3976062769], length 0
22:02:42.619559 IP 187.45.96.51.https > 10.20.30.10.60050: Flags [.], seq 165625:168521, ack 646, win 243, options [nop,nop,TS val 3976062769 ecr 2587788194], length 2896
22:02:42.619587 IP 10.20.30.10.60050 > 187.45.96.51.https: Flags [.], ack 168521, win 1851, options [nop,nop,TS val 2587788200 ecr 3976062769], length 0
22:02:42.619795 IP 187.45.96.51.https > 10.20.30.10.60050: Flags [.], seq 168521:171417, ack 646, win 243, options [nop,nop,TS val 3976062769 ecr 2587788194], length 2896
22:02:42.619800 IP 10.20.30.10.60050 > 187.45.96.51.https: Flags [.], ack 171417, win 1897, options [nop,nop,TS val 2587788200 ecr 3976062769], length 0
22:02:42.620055 IP 187.45.96.51.https > 10.20.30.10.60050: Flags [.], seq 171417:175761, ack 646, win 243, options [nop,nop,TS val 3976062769 ecr 2587788194], length 4344
22:02:42.620061 IP 10.20.30.10.60050 > 187.45.96.51.https: Flags [.], ack 175761, win 1965, options [nop,nop,TS val 2587788200 ecr 3976062769], length 0
22:02:42.620340 IP 187.45.96.51.https > 10.20.30.10.60050: Flags [.], seq 175761:178657, ack 646, win 243, options [nop,nop,TS val 3976062769 ecr 2587788194], length 2896
22:02:42.620372 IP 10.20.30.10.60050 > 187.45.96.51.https: Flags [.], ack 178657, win 2010, options [nop,nop,TS val 2587788200 ecr 3976062769], length 0
22:02:42.620578 IP 187.45.96.51.https > 10.20.30.10.60050: Flags [.], seq 178657:180105, ack 646, win 243, options [nop,nop,TS val 3976062769 ecr 2587788194], length 1448
22:02:42.620818 IP 187.45.96.51.https > 10.20.30.10.60050: Flags [.], seq 180105:184449, ack 646, win 243, options [nop,nop,TS val 3976062769 ecr 2587788194], length 4344
22:02:42.620853 IP 10.20.30.10.60050 > 187.45.96.51.https: Flags [.], ack 184449, win 2100, options [nop,nop,TS val 2587788200 ecr 3976062769], length 0
22:02:42.621022 IP 187.45.96.51.https > 10.20.30.10.60050: Flags [.], seq 184449:187345, ack 646, win 243, options [nop,nop,TS val 3976062769 ecr 2587788194], length 2896
22:02:42.621030 IP 10.20.30.10.60050 > 187.45.96.51.https: Flags [.], ack 187345, win 2146, options [nop,nop,TS val 2587788201 ecr 3976062769], length 0
22:02:42.621321 IP 187.45.96.51.https > 10.20.30.10.60050: Flags [.], seq 187345:190241, ack 646, win 243, options [nop,nop,TS val 3976062769 ecr 2587788194], length 2896
22:02:42.621336 IP 10.20.30.10.60050 > 187.45.96.51.https: Flags [.], ack 190241, win 2191, options [nop,nop,TS val 2587788201 ecr 3976062769], length 0
22:02:42.621593 IP 187.45.96.51.https > 10.20.30.10.60050: Flags [.], seq 190241:193137, ack 646, win 243, options [nop,nop,TS val 3976062769 ecr 2587788194], length 2896
22:02:42.621655 IP 10.20.30.10.60050 > 187.45.96.51.https: Flags [.], ack 193137, win 2236, options [nop,nop,TS val 2587788201 ecr 3976062769], length 0
22:02:42.621918 IP 187.45.96.51.https > 10.20.30.10.60050: Flags [.], seq 193137:196033, ack 646, win 243, options [nop,nop,TS val 3976062769 ecr 2587788194], length 2896
22:02:42.621944 IP 10.20.30.10.60050 > 187.45.96.51.https: Flags [.], ack 196033, win 2281, options [nop,nop,TS val 2587788201 ecr 3976062769], length 0
22:02:42.622034 IP 187.45.96.51.https > 10.20.30.10.60050: Flags [.], seq 196033:197481, ack 646, win 243, options [nop,nop,TS val 3976062769 ecr 2587788194], length 1448
22:02:42.622042 IP 187.45.96.51.https > 10.20.30.10.60050: Flags [.], seq 197481:198929, ack 646, win 243, options [nop,nop,TS val 3976062770 ecr 2587788194], length 1448
22:02:42.622058 IP 10.20.30.10.60050 > 187.45.96.51.https: Flags [.], ack 198929, win 2327, options [nop,nop,TS val 2587788201 ecr 3976062769], length 0
22:02:42.622339 IP 187.45.96.51.https > 10.20.30.10.60050: Flags [.], seq 198929:201825, ack 646, win 243, options [nop,nop,TS val 3976062770 ecr 2587788194], length 2896
22:02:42.622373 IP 10.20.30.10.60050 > 187.45.96.51.https: Flags [.], ack 201825, win 2372, options [nop,nop,TS val 2587788201 ecr 3976062770], length 0
22:02:42.622527 IP 187.45.96.51.https > 10.20.30.10.60050: Flags [.], seq 201825:203273, ack 646, win 243, options [nop,nop,TS val 3976062770 ecr 2587788194], length 1448
22:02:42.635536 IP 187.45.96.51.https > 10.20.30.10.60050: Flags [.], seq 203273:204721, ack 646, win 243, options [nop,nop,TS val 3976062774 ecr 2587788199], length 1448
22:02:42.635572 IP 10.20.30.10.60050 > 187.45.96.51.https: Flags [.], ack 204721, win 2417, options [nop,nop,TS val 2587788204 ecr 3976062770], length 0
22:02:42.635740 IP 187.45.96.51.https > 10.20.30.10.60050: Flags [.], seq 204721:207617, ack 646, win 243, options [nop,nop,TS val 3976062774 ecr 2587788199], length 2896
22:02:42.635775 IP 10.20.30.10.60050 > 187.45.96.51.https: Flags [.], ack 207617, win 2462, options [nop,nop,TS val 2587788204 ecr 3976062774], length 0
22:02:42.636007 IP 187.45.96.51.https > 10.20.30.10.60050: Flags [.], seq 207617:210513, ack 646, win 243, options [nop,nop,TS val 3976062774 ecr 2587788199], length 2896
22:02:42.636040 IP 10.20.30.10.60050 > 187.45.96.51.https: Flags [.], ack 210513, win 2508, options [nop,nop,TS val 2587788204 ecr 3976062774], length 0
22:02:42.636227 IP 187.45.96.51.https > 10.20.30.10.60050: Flags [.], seq 210513:213409, ack 646, win 243, options [nop,nop,TS val 3976062774 ecr 2587788199], length 2896
22:02:42.636259 IP 10.20.30.10.60050 > 187.45.96.51.https: Flags [.], ack 213409, win 2530, options [nop,nop,TS val 2587788204 ecr 3976062774], length 0
22:02:42.636507 IP 187.45.96.51.https > 10.20.30.10.60050: Flags [.], seq 213409:216305, ack 646, win 243, options [nop,nop,TS val 3976062774 ecr 2587788199], length 2896
22:02:42.636540 IP 10.20.30.10.60050 > 187.45.96.51.https: Flags [.], ack 216305, win 2530, options [nop,nop,TS val 2587788204 ecr 3976062774], length 0
22:02:42.636711 IP 187.45.96.51.https > 10.20.30.10.60050: Flags [.], seq 216305:219201, ack 646, win 243, options [nop,nop,TS val 3976062774 ecr 2587788199], length 2896
22:02:42.636731 IP 10.20.30.10.60050 > 187.45.96.51.https: Flags [.], ack 219201, win 2530, options [nop,nop,TS val 2587788204 ecr 3976062774], length 0
22:02:42.636940 IP 187.45.96.51.https > 10.20.30.10.60050: Flags [.], seq 219201:222097, ack 646, win 243, options [nop,nop,TS val 3976062774 ecr 2587788199], length 2896
22:02:42.636946 IP 10.20.30.10.60050 > 187.45.96.51.https: Flags [.], ack 222097, win 2530, options [nop,nop,TS val 2587788205 ecr 3976062774], length 0
22:02:42.637183 IP 187.45.96.51.https > 10.20.30.10.60050: Flags [.], seq 222097:224993, ack 646, win 243, options [nop,nop,TS val 3976062774 ecr 2587788199], length 2896
22:02:42.637187 IP 10.20.30.10.60050 > 187.45.96.51.https: Flags [.], ack 224993, win 2530, options [nop,nop,TS val 2587788205 ecr 3976062774], length 0
22:02:42.637447 IP 187.45.96.51.https > 10.20.30.10.60050: Flags [.], seq 224993:227889, ack 646, win 243, options [nop,nop,TS val 3976062774 ecr 2587788199], length 2896
22:02:42.637469 IP 10.20.30.10.60050 > 187.45.96.51.https: Flags [.], ack 227889, win 2530, options [nop,nop,TS val 2587788205 ecr 3976062774], length 0
22:02:42.637772 IP 187.45.96.51.https > 10.20.30.10.60050: Flags [.], seq 227889:232233, ack 646, win 243, options [nop,nop,TS val 3976062774 ecr 2587788199], length 4344
22:02:42.637809 IP 10.20.30.10.60050 > 187.45.96.51.https: Flags [.], ack 232233, win 2530, options [nop,nop,TS val 2587788205 ecr 3976062774], length 0
22:02:42.637948 IP 187.45.96.51.https > 10.20.30.10.60050: Flags [.], seq 232233:233681, ack 646, win 243, options [nop,nop,TS val 3976062774 ecr 2587788199], length 1448
22:02:42.638193 IP 187.45.96.51.https > 10.20.30.10.60050: Flags [.], seq 233681:236577, ack 646, win 243, options [nop,nop,TS val 3976062774 ecr 2587788199], length 2896
22:02:42.638204 IP 10.20.30.10.60050 > 187.45.96.51.https: Flags [.], ack 236577, win 2530, options [nop,nop,TS val 2587788205 ecr 3976062774], length 0
22:02:42.638482 IP 187.45.96.51.https > 10.20.30.10.60050: Flags [.], seq 236577:239473, ack 646, win 243, options [nop,nop,TS val 3976062774 ecr 2587788199], length 2896
22:02:42.638489 IP 10.20.30.10.60050 > 187.45.96.51.https: Flags [.], ack 239473, win 2530, options [nop,nop,TS val 2587788205 ecr 3976062774], length 0
22:02:42.638755 IP 187.45.96.51.https > 10.20.30.10.60050: Flags [.], seq 239473:243817, ack 646, win 243, options [nop,nop,TS val 3976062774 ecr 2587788199], length 4344
22:02:42.638914 IP 10.20.30.10.60050 > 187.45.96.51.https: Flags [.], ack 243817, win 2511, options [nop,nop,TS val 2587788205 ecr 3976062774], length 0
22:02:42.639315 IP 187.45.96.51.https > 10.20.30.10.60050: Flags [.], seq 243817:246713, ack 646, win 243, options [nop,nop,TS val 3976062775 ecr 2587788199], length 2896
22:02:42.639327 IP 187.45.96.51.https > 10.20.30.10.60050: Flags [.], seq 246713:249609, ack 646, win 243, options [nop,nop,TS val 3976062775 ecr 2587788199], length 2896
22:02:42.639349 IP 10.20.30.10.60050 > 187.45.96.51.https: Flags [.], ack 246713, win 2530, options [nop,nop,TS val 2587788205 ecr 3976062775], length 0
22:02:42.639359 IP 10.20.30.10.60050 > 187.45.96.51.https: Flags [.], ack 249609, win 2530, options [nop,nop,TS val 2587788205 ecr 3976062775], length 0
22:02:42.639469 IP 187.45.96.51.https > 10.20.30.10.60050: Flags [.], seq 249609:252505, ack 646, win 243, options [nop,nop,TS val 3976062775 ecr 2587788199], length 2896
22:02:42.639490 IP 10.20.30.10.60050 > 187.45.96.51.https: Flags [.], ack 252505, win 2530, options [nop,nop,TS val 2587788205 ecr 3976062775], length 0
22:02:42.639708 IP 187.45.96.51.https > 10.20.30.10.60050: Flags [.], seq 252505:255401, ack 646, win 243, options [nop,nop,TS val 3976062775 ecr 2587788199], length 2896
22:02:42.639712 IP 10.20.30.10.60050 > 187.45.96.51.https: Flags [.], ack 255401, win 2530, options [nop,nop,TS val 2587788205 ecr 3976062775], length 0
22:02:42.639947 IP 187.45.96.51.https > 10.20.30.10.60050: Flags [.], seq 255401:258297, ack 646, win 243, options [nop,nop,TS val 3976062775 ecr 2587788199], length 2896
22:02:42.640008 IP 10.20.30.10.60050 > 187.45.96.51.https: Flags [.], ack 258297, win 2529, options [nop,nop,TS val 2587788205 ecr 3976062775], length 0
22:02:42.640263 IP 187.45.96.51.https > 10.20.30.10.60050: Flags [.], seq 258297:261193, ack 646, win 243, options [nop,nop,TS val 3976062775 ecr 2587788199], length 2896
22:02:42.640301 IP 10.20.30.10.60050 > 187.45.96.51.https: Flags [.], ack 261193, win 2530, options [nop,nop,TS val 2587788205 ecr 3976062775], length 0
22:02:42.640598 IP 187.45.96.51.https > 10.20.30.10.60050: Flags [.], seq 261193:264089, ack 646, win 243, options [nop,nop,TS val 3976062775 ecr 2587788199], length 2896
22:02:42.640631 IP 10.20.30.10.60050 > 187.45.96.51.https: Flags [.], ack 264089, win 2530, options [nop,nop,TS val 2587788205 ecr 3976062775], length 0
22:02:42.640748 IP 187.45.96.51.https > 10.20.30.10.60050: Flags [.], seq 264089:266985, ack 646, win 243, options [nop,nop,TS val 3976062775 ecr 2587788199], length 2896
22:02:42.640779 IP 10.20.30.10.60050 > 187.45.96.51.https: Flags [.], ack 266985, win 2530, options [nop,nop,TS val 2587788205 ecr 3976062775], length 0
22:02:42.640959 IP 187.45.96.51.https > 10.20.30.10.60050: Flags [.], seq 266985:269881, ack 646, win 243, options [nop,nop,TS val 3976062775 ecr 2587788199], length 2896
22:02:42.640965 IP 10.20.30.10.60050 > 187.45.96.51.https: Flags [.], ack 269881, win 2530, options [nop,nop,TS val 2587788206 ecr 3976062775], length 0
22:02:42.641204 IP 187.45.96.51.https > 10.20.30.10.60050: Flags [.], seq 269881:272777, ack 646, win 243, options [nop,nop,TS val 3976062775 ecr 2587788199], length 2896
22:02:42.641208 IP 10.20.30.10.60050 > 187.45.96.51.https: Flags [.], ack 272777, win 2530, options [nop,nop,TS val 2587788206 ecr 3976062775], length 0
22:02:42.641506 IP 187.45.96.51.https > 10.20.30.10.60050: Flags [.], seq 272777:275673, ack 646, win 243, options [nop,nop,TS val 3976062775 ecr 2587788199], length 2896
22:02:42.641530 IP 10.20.30.10.60050 > 187.45.96.51.https: Flags [.], ack 275673, win 2576, options [nop,nop,TS val 2587788206 ecr 3976062775], length 0
22:02:42.641727 IP 187.45.96.51.https > 10.20.30.10.60050: Flags [.], seq 275673:278569, ack 646, win 243, options [nop,nop,TS val 3976062775 ecr 2587788199], length 2896
22:02:42.641746 IP 10.20.30.10.60050 > 187.45.96.51.https: Flags [.], ack 278569, win 2621, options [nop,nop,TS val 2587788206 ecr 3976062775], length 0
22:02:42.641971 IP 187.45.96.51.https > 10.20.30.10.60050: Flags [.], seq 278569:281465, ack 646, win 243, options [nop,nop,TS val 3976062775 ecr 2587788199], length 2896
22:02:42.641989 IP 10.20.30.10.60050 > 187.45.96.51.https: Flags [.], ack 281465, win 2666, options [nop,nop,TS val 2587788206 ecr 3976062775], length 0
22:02:42.642256 IP 187.45.96.51.https > 10.20.30.10.60050: Flags [.], seq 281465:284361, ack 646, win 243, options [nop,nop,TS val 3976062775 ecr 2587788199], length 2896
22:02:42.642273 IP 10.20.30.10.60050 > 187.45.96.51.https: Flags [.], ack 284361, win 2711, options [nop,nop,TS val 2587788206 ecr 3976062775], length 0
22:02:42.642449 IP 187.45.96.51.https > 10.20.30.10.60050: Flags [.], seq 284361:287257, ack 646, win 243, options [nop,nop,TS val 3976062775 ecr 2587788200], length 2896
22:02:42.642453 IP 10.20.30.10.60050 > 187.45.96.51.https: Flags [.], ack 287257, win 2757, options [nop,nop,TS val 2587788206 ecr 3976062775], length 0
22:02:42.642700 IP 187.45.96.51.https > 10.20.30.10.60050: Flags [.], seq 287257:290153, ack 646, win 243, options [nop,nop,TS val 3976062775 ecr 2587788200], length 2896
22:02:42.642703 IP 10.20.30.10.60050 > 187.45.96.51.https: Flags [.], ack 290153, win 2802, options [nop,nop,TS val 2587788206 ecr 3976062775], length 0
22:02:42.642974 IP 187.45.96.51.https > 10.20.30.10.60050: Flags [.], seq 290153:293049, ack 646, win 243, options [nop,nop,TS val 3976062775 ecr 2587788200], length 2896
22:02:42.642994 IP 10.20.30.10.60050 > 187.45.96.51.https: Flags [.], ack 293049, win 2847, options [nop,nop,TS val 2587788206 ecr 3976062775], length 0
22:02:42.643237 IP 187.45.96.51.https > 10.20.30.10.60050: Flags [.], seq 293049:295945, ack 646, win 243, options [nop,nop,TS val 3976062775 ecr 2587788200], length 2896
22:02:42.643255 IP 10.20.30.10.60050 > 187.45.96.51.https: Flags [.], ack 295945, win 2892, options [nop,nop,TS val 2587788206 ecr 3976062775], length 0
22:02:42.643474 IP 187.45.96.51.https > 10.20.30.10.60050: Flags [.], seq 295945:298841, ack 646, win 243, options [nop,nop,TS val 3976062775 ecr 2587788200], length 2896
22:02:42.643492 IP 10.20.30.10.60050 > 187.45.96.51.https: Flags [.], ack 298841, win 2938, options [nop,nop,TS val 2587788206 ecr 3976062775], length 0
22:02:42.643720 IP 187.45.96.51.https > 10.20.30.10.60050: Flags [.], seq 298841:301737, ack 646, win 243, options [nop,nop,TS val 3976062775 ecr 2587788200], length 2896
22:02:42.643737 IP 10.20.30.10.60050 > 187.45.96.51.https: Flags [.], ack 301737, win 2983, options [nop,nop,TS val 2587788206 ecr 3976062775], length 0
22:02:42.643954 IP 187.45.96.51.https > 10.20.30.10.60050: Flags [.], seq 301737:304633, ack 646, win 243, options [nop,nop,TS val 3976062775 ecr 2587788200], length 2896
22:02:42.643958 IP 10.20.30.10.60050 > 187.45.96.51.https: Flags [.], ack 304633, win 3028, options [nop,nop,TS val 2587788206 ecr 3976062775], length 0
22:02:42.644205 IP 187.45.96.51.https > 10.20.30.10.60050: Flags [.], seq 304633:307529, ack 646, win 243, options [nop,nop,TS val 3976062775 ecr 2587788200], length 2896
22:02:42.644209 IP 10.20.30.10.60050 > 187.45.96.51.https: Flags [.], ack 307529, win 3073, options [nop,nop,TS val 2587788206 ecr 3976062775], length 0
22:02:42.644477 IP 187.45.96.51.https > 10.20.30.10.60050: Flags [.], seq 307529:310425, ack 646, win 243, options [nop,nop,TS val 3976062775 ecr 2587788200], length 2896
22:02:42.644497 IP 10.20.30.10.60050 > 187.45.96.51.https: Flags [.], ack 310425, win 3119, options [nop,nop,TS val 2587788206 ecr 3976062775], length 0
22:02:42.644727 IP 187.45.96.51.https > 10.20.30.10.60050: Flags [.], seq 310425:313321, ack 646, win 243, options [nop,nop,TS val 3976062775 ecr 2587788200], length 2896
22:02:42.644745 IP 10.20.30.10.60050 > 187.45.96.51.https: Flags [.], ack 313321, win 3164, options [nop,nop,TS val 2587788206 ecr 3976062775], length 0
22:02:42.644973 IP 187.45.96.51.https > 10.20.30.10.60050: Flags [.], seq 313321:316217, ack 646, win 243, options [nop,nop,TS val 3976062775 ecr 2587788200], length 2896
22:02:42.644993 IP 10.20.30.10.60050 > 187.45.96.51.https: Flags [.], ack 316217, win 3209, options [nop,nop,TS val 2587788207 ecr 3976062775], length 0
22:02:42.645202 IP 187.45.96.51.https > 10.20.30.10.60050: Flags [.], seq 316217:319113, ack 646, win 243, options [nop,nop,TS val 3976062775 ecr 2587788200], length 2896
22:02:42.645206 IP 10.20.30.10.60050 > 187.45.96.51.https: Flags [.], ack 319113, win 3254, options [nop,nop,TS val 2587788207 ecr 3976062775], length 0
22:02:42.645454 IP 187.45.96.51.https > 10.20.30.10.60050: Flags [.], seq 319113:322009, ack 646, win 243, options [nop,nop,TS val 3976062775 ecr 2587788200], length 2896
22:02:42.645457 IP 10.20.30.10.60050 > 187.45.96.51.https: Flags [.], ack 322009, win 3300, options [nop,nop,TS val 2587788207 ecr 3976062775], length 0
22:02:42.645737 IP 187.45.96.51.https > 10.20.30.10.60050: Flags [.], seq 322009:324905, ack 646, win 243, options [nop,nop,TS val 3976062775 ecr 2587788200], length 2896
22:02:42.645745 IP 187.45.96.51.https > 10.20.30.10.60050: Flags [.], seq 324905:326353, ack 646, win 243, options [nop,nop,TS val 3976062776 ecr 2587788200], length 1448
22:02:42.645761 IP 10.20.30.10.60050 > 187.45.96.51.https: Flags [.], ack 324905, win 3345, options [nop,nop,TS val 2587788207 ecr 3976062775], length 0
22:02:42.645977 IP 187.45.96.51.https > 10.20.30.10.60050: Flags [.], seq 326353:329249, ack 646, win 243, options [nop,nop,TS val 3976062776 ecr 2587788200], length 2896
22:02:42.645996 IP 10.20.30.10.60050 > 187.45.96.51.https: Flags [.], ack 329249, win 3413, options [nop,nop,TS val 2587788207 ecr 3976062776], length 0
22:02:42.646229 IP 187.45.96.51.https > 10.20.30.10.60050: Flags [.], seq 329249:332145, ack 646, win 243, options [nop,nop,TS val 3976062776 ecr 2587788200], length 2896
22:02:42.646247 IP 10.20.30.10.60050 > 187.45.96.51.https: Flags [.], ack 332145, win 3458, options [nop,nop,TS val 2587788207 ecr 3976062776], length 0
22:02:42.646452 IP 187.45.96.51.https > 10.20.30.10.60050: Flags [.], seq 332145:335041, ack 646, win 243, options [nop,nop,TS val 3976062776 ecr 2587788200], length 2896
22:02:42.646454 IP 10.20.30.10.60050 > 187.45.96.51.https: Flags [.], ack 335041, win 3503, options [nop,nop,TS val 2587788207 ecr 3976062776], length 0
22:02:42.646692 IP 187.45.96.51.https > 10.20.30.10.60050: Flags [.], seq 335041:337937, ack 646, win 243, options [nop,nop,TS val 3976062776 ecr 2587788200], length 2896
22:02:42.646701 IP 10.20.30.10.60050 > 187.45.96.51.https: Flags [.], ack 337937, win 3549, options [nop,nop,TS val 2587788207 ecr 3976062776], length 0
22:02:42.646948 IP 187.45.96.51.https > 10.20.30.10.60050: Flags [.], seq 337937:340833, ack 646, win 243, options [nop,nop,TS val 3976062776 ecr 2587788200], length 2896
